{
  "$schema": "https://json-schema.org/draft/2020-12/schema",
  "$id": "ecosystem/contracts/integration-policy/1",
  "title": "Política de integração — schemaVersion 1",
  "description": "Autoridade única da política de integração (ADD-0012, ADR-0015): o que é rotina (integra sozinho) e o que é crítico (espera o proprietário). Lida sempre da main pelo integrador; um PR que muda este arquivo é crítico pela política anterior.",
  "type": "object",
  "additionalProperties": false,
  "required": ["schemaVersion", "decision", "mechanism", "routine", "critical", "authorization", "classes"],
  "properties": {
    "$schema": { "type": "string" },
    "schemaVersion": { "const": 1 },
    "decision": { "description": "Registro da decisão do proprietário que fixa a política.", "type": "string", "minLength": 1 },
    "mechanism": { "description": "ADR do mecanismo.", "type": "string", "minLength": 1 },
    "routine": { "description": "O que acontece com uma mudança rotineira verde.", "enum": ["automatic", "owner-authorization"] },
    "critical": { "description": "O que acontece com uma mudança crítica verde.", "enum": ["owner-authorization"] },
    "authorization": {
      "type": "object",
      "additionalProperties": false,
      "required": ["label", "authorizers"],
      "properties": {
        "label": { "type": "string", "minLength": 1 },
        "authorizers": {
          "description": "Quem pode autorizar uma mudança crítica: '@repository-owner' ou logins explicitamente autorizados pelo proprietário. O integrador confere o autor do evento que pôs a label.",
          "type": "array", "minItems": 1, "items": { "type": "string", "minLength": 1 }
        }
      }
    },
    "classes": {
      "type": "array",
      "minItems": 1,
      "items": {
        "type": "object",
        "additionalProperties": false,
        "required": ["id", "title", "consequence", "paths", "rules"],
        "properties": {
          "id": { "type": "string", "pattern": "^[a-z][a-z0-9]*(-[a-z0-9]+)*$" },
          "title": { "type": "string", "minLength": 1 },
          "consequence": { "description": "O que o proprietário precisa saber para autorizar.", "type": "string", "minLength": 1 },
          "paths": {
            "description": "Zonas críticas por caminho (glob: * dentro de um segmento, ** atravessa segmentos). Qualquer mudança nelas é crítica (falha fechada).",
            "type": "array", "items": { "type": "string", "minLength": 1 }
          },
          "rules": {
            "description": "Regras semânticas implementadas pelo checker confiável (tests/consistency/Check.cs da main): só a mudança que a regra detecta é crítica.",
            "type": "array",
            "items": {
              "type": "object",
              "additionalProperties": false,
              "required": ["rule", "paths"],
              "properties": {
                "rule": { "enum": ["decision-record", "adr-decision", "trust-weakening", "json-keys", "schema-breaking", "capability-breaking", "manifest-structure"] },
                "paths": { "type": "array", "minItems": 1, "items": { "type": "string", "minLength": 1 } },
                "keys": { "description": "json-keys: ponteiros JSON (RFC 6901) cujo valor, se mudar, torna a mudança crítica.", "type": "array", "items": { "type": "string", "minLength": 1 } }
              }
            }
          }
        }
      }
    }
  }
}
